Product Name,Price,Description,Category,Image
Assam Black Tea,INR 350,Rich and malty black tea from Assam region with bold flavor perfect for morning brew,Black Tea,assam-black-tea.jpg
Earl Grey,INR 375,Classic blend of black tea infused with bergamot oil for a citrusy aroma and taste,Flavored Tea,earl-grey.jpg
Darjeeling,INR 400,Premium muscatel flavored tea from the foothills of Himalayas with delicate taste,Black Tea,darjeeling.jpg
Green Tea Jasmine,INR 500,Delicate green tea scented with fresh jasmine flowers for a floral experience,Green Tea,jasmine-green.jpg
Masala Chai,INR 450,Traditional Indian spiced tea blend with cardamom cinnamon ginger and cloves,Spiced Tea,masala-chai.jpg
Oolong Tea,INR 500,Semi-fermented tea with complex flavor profile between black and green tea,Oolong Tea,oolong.jpg
White Tea Silver Needle,INR 550,Premium white tea with subtle sweet flavor and high antioxidant content,White Tea,white-silver-needle.jpg
Herbal Chamomile,INR 600,Caffeine-free herbal tea with calming properties perfect for evening relaxation,Herbal Tea,chamomile.jpg
